{
  "version": "1.0",
  "workspace": { "name": "Plataforma de datos de ventas", "description": "De los sistemas operacionales al panel de ventas y el modelo de fuga de clientes" },
  "domains": [
    { "id": "ventas", "name": "Ventas", "owner": "Equipo Ventas" },
    { "id": "clientes", "name": "Clientes", "owner": "Equipo CRM" },
    { "id": "plataforma", "name": "Plataforma de datos", "owner": "Equipo Plataforma" }
  ],
  "assets": [
    { "id": "crm", "kind": "source", "name": "CRM", "technology": "Salesforce", "domainId": "clientes", "owner": "Equipo CRM", "external": true },
    {
      "id": "crm-clientes", "kind": "table", "name": "clientes", "parentId": "crm", "classification": "confidential", "retention": "5 años tras la baja",
      "columns": [
        { "name": "id", "type": "uuid", "keys": ["pk"] },
        { "name": "nombre", "type": "text", "pii": true },
        { "name": "email", "type": "text", "pii": true },
        { "name": "pais", "type": "text" }
      ]
    },
    { "id": "erp", "kind": "source", "name": "ERP de pedidos", "technology": "PostgreSQL", "domainId": "ventas", "owner": "Equipo Ventas", "ref": "urn:iark:integration:pedidos" },
    {
      "id": "erp-pedidos", "kind": "table", "name": "pedidos", "parentId": "erp", "classification": "internal",
      "columns": [
        { "name": "id", "type": "bigint", "keys": ["pk"] },
        { "name": "cliente_id", "type": "uuid", "keys": ["fk"] },
        { "name": "fecha", "type": "date" },
        { "name": "total", "type": "numeric" }
      ]
    },
    {
      "id": "erp-lineas", "kind": "table", "name": "líneas de pedido", "parentId": "erp", "classification": "internal",
      "columns": [
        { "name": "pedido_id", "type": "bigint", "keys": ["pk", "fk"] },
        { "name": "producto", "type": "text", "keys": ["pk"] },
        { "name": "cantidad", "type": "int" },
        { "name": "precio", "type": "numeric" }
      ]
    },
    { "id": "lake", "kind": "lake", "name": "Lakehouse de ventas", "technology": "S3 + Delta Lake", "domainId": "plataforma", "owner": "Equipo Plataforma" },
    { "id": "bronze-clientes", "kind": "table", "name": "bronce: clientes", "parentId": "lake", "classification": "confidential", "pii": true, "retention": "5 años tras la baja" },
    { "id": "bronze-pedidos", "kind": "table", "name": "bronce: pedidos", "parentId": "lake", "classification": "internal" },
    { "id": "silver-ventas", "kind": "table", "name": "plata: ventas", "parentId": "lake", "classification": "confidential", "pii": true, "retention": "5 años tras la baja" },
    { "id": "dwh", "kind": "warehouse", "name": "DWH corporativo", "technology": "Snowflake", "domainId": "plataforma", "owner": "Equipo Plataforma" },
    {
      "id": "dwh-dim-cliente", "kind": "table", "name": "dim_cliente", "parentId": "dwh", "classification": "confidential", "retention": "5 años tras la baja",
      "columns": [
        { "name": "cliente_key", "type": "int", "keys": ["pk"] },
        { "name": "nombre", "type": "text", "pii": true },
        { "name": "pais", "type": "text" }
      ]
    },
    {
      "id": "dwh-fact-ventas", "kind": "table", "name": "fact_ventas", "parentId": "dwh", "classification": "internal",
      "columns": [
        { "name": "venta_key", "type": "bigint", "keys": ["pk"] },
        { "name": "cliente_key", "type": "int", "keys": ["fk"] },
        { "name": "fecha", "type": "date" },
        { "name": "importe", "type": "numeric" }
      ]
    },
    { "id": "panel-ventas", "kind": "report", "name": "Panel de ventas", "technology": "Power BI", "domainId": "ventas", "owner": "Equipo BI", "classification": "internal" },
    { "id": "modelo-fuga", "kind": "model", "name": "Modelo de fuga de clientes", "technology": "scikit-learn", "domainId": "clientes", "owner": "Ciencia de datos", "classification": "confidential", "pii": true, "retention": "2 años" }
  ],
  "pipelines": [
    { "id": "ingesta-crm", "name": "Ingesta del CRM", "kind": "cdc", "inputs": ["crm-clientes"], "outputs": ["bronze-clientes"], "tool": "Debezium" },
    { "id": "ingesta-erp", "name": "Ingesta del ERP", "kind": "batch", "inputs": ["erp-pedidos", "erp-lineas"], "outputs": ["bronze-pedidos"], "tool": "Airflow", "schedule": "diaria 02:00" },
    { "id": "limpieza", "name": "Limpieza y unión", "kind": "elt", "inputs": ["bronze-pedidos", "bronze-clientes"], "outputs": ["silver-ventas"], "tool": "dbt", "schedule": "diaria 03:00" },
    { "id": "carga-dimension", "name": "Carga de dimensión de clientes", "kind": "elt", "inputs": ["silver-ventas"], "outputs": ["dwh-dim-cliente"], "tool": "dbt", "schedule": "diaria 04:00" },
    { "id": "carga-hechos", "name": "Carga de hechos (seudonimiza)", "kind": "elt", "inputs": ["silver-ventas"], "outputs": ["dwh-fact-ventas"], "tool": "dbt", "schedule": "diaria 04:00", "anonymizes": true },
    { "id": "publica-panel", "name": "Actualiza el panel", "kind": "batch", "inputs": ["dwh-fact-ventas"], "outputs": ["panel-ventas"], "tool": "Power BI", "schedule": "diaria 06:00" },
    { "id": "entrena-fuga", "name": "Entrenamiento del modelo", "kind": "batch", "inputs": ["dwh-dim-cliente", "dwh-fact-ventas"], "outputs": ["modelo-fuga"], "tool": "MLflow", "schedule": "semanal" }
  ],
  "relations": [
    { "id": "pedido-lineas", "sourceId": "erp-pedidos", "targetId": "erp-lineas", "cardinality": "1:N", "description": "contiene" },
    { "id": "cliente-ventas", "sourceId": "dwh-dim-cliente", "targetId": "dwh-fact-ventas", "cardinality": "1:N", "description": "compra" }
  ]
}
